{
  "$schema": "https://raw.githubusercontent.com/adibirzu/llm-router-axi/main/policy.schema.json",
  "version": 1,
  "routing": {
    "reservePercent": 20,
    "cooldownSeconds": 1800,
    "telemetryMaxAgeSeconds": 300,
    "maxFallbacks": 4
  },
  "capacity": {
    "agentCeiling": 10,
    "oneSuiteAtATime": true,
    "maxConcurrentSuites": 1,
    "memoryFreeReservePercent": 10,
    "maxLoadPerCore": 2,
    "memoryPressureMax": "warn",
    "maxSwapUsedPercent": null,
    "llamaParallel": 2
  },
  "pools": {
    "cursor": {
      "default": "auto_usage",
      "auto": "auto_usage",
      "api": "api_usage"
    },
    "agy": {
      "default": "gemini",
      "gemini": ["gemini_5h", "gemini_weekly"],
      "nonGemini": ["claude_gpt_5h", "claude_gpt_weekly"]
    },
    "opencode": {
      "default": "opencode-go",
      "go": "opencode-go",
      "free": "opencode",
      "goWindows": ["rolling", "weekly"]
    }
  },
  "spendPriority": {
    "weight": 1,
    "tieBreaker": "least-recent-use",
    "preferKnown": true
  },
  "jev": {
    "shadow": {
      "enabled": false
    }
  },
  "candidateGroups": {
    "architects": [
      { "harness": "claude", "provider": "claude" },
      { "harness": "codex", "provider": "codex" }
    ],
    "reviewers": [
      { "harness": "grok", "provider": "grok" },
      { "harness": "agy", "provider": "agy", "pool": "gemini" },
      { "harness": "cursor", "provider": "cursor", "pool": "auto_usage" }
    ],
    "reviewers-escalated": [
      { "harness": "grok", "provider": "grok" },
      { "harness": "agy", "provider": "agy", "pool": "gemini" },
      { "harness": "cursor", "provider": "cursor", "pool": "auto_usage" },
      { "harness": "claude", "provider": "claude" },
      { "harness": "codex", "provider": "codex" }
    ],
    "workers": [
      {
        "harness": "opencode",
        "provider": "opencode",
        "pool": "opencode-go",
        "model": "opencode-go/deepseek-v4.1-flash"
      },
      {
        "harness": "opencode",
        "provider": "opencode",
        "pool": "opencode-go",
        "model": "opencode-go/muse-spark-1.3-contributor"
      },
      {
        "harness": "opencode",
        "provider": "opencode",
        "pool": "opencode-go",
        "model": "opencode-go/qwen3.8-flash"
      },
      {
        "harness": "opencode",
        "provider": "opencode",
        "pool": "opencode-go",
        "model": "opencode-go/kimi-k2.7-code"
      },
      {
        "harness": "opencode",
        "provider": "opencode",
        "pool": "opencode",
        "model": "opencode/big-pickle"
      },
      {
        "harness": "opencode",
        "provider": "opencode",
        "pool": "opencode",
        "model": "opencode/muse-spark-1.3-contributor-free"
      },
      {
        "harness": "opencode",
        "provider": "opencode",
        "pool": "opencode",
        "model": "opencode/mimo-v2.5-free"
      },
      {
        "harness": "opencode",
        "provider": "opencode",
        "pool": "opencode",
        "model": "opencode/nemotron-3.5-lightning-free"
      },
      {
        "harness": "opencode",
        "provider": "opencode",
        "pool": "opencode",
        "model": "opencode/ling-3.0-flash-fin-free"
      },
      {
        "harness": "opencode",
        "provider": "opencode",
        "pool": "opencode",
        "model": "opencode/nemotron-3-ultra-free"
      },
      { "harness": "grok", "provider": "grok" },
      { "harness": "cursor", "provider": "cursor", "pool": "auto_usage" },
      { "harness": "agy", "provider": "agy", "pool": "gemini" }
    ]
  },
  "modelFallback": {
    "claude": ["sonnet", "opus", "haiku"],
    "agy": [
      "gemini-3.8-flash",
      "gemini-3.7-flash",
      "gemini-3.6-flash",
      "gemini-2.5-flash"
    ],
    "cursor": ["auto", "cursor-grok-4.6-high"],
    "opencode": [
      "opencode-go/deepseek-v4.1-flash",
      "opencode-go/muse-spark-1.3-contributor",
      "opencode-go/qwen3.8-flash",
      "opencode-go/kimi-k2.7-code",
      "opencode/big-pickle",
      "opencode/muse-spark-1.3-contributor-free",
      "opencode/mimo-v2.5-free",
      "opencode/nemotron-3.5-lightning-free"
    ]
  },
  "fallbackLanes": ["opencode", "grok", "cursor", "agy", "claude"],
  "modelFallbackCycles": ["opencode", "cursor", "agy", "claude"],
  "kinds": {
    "architecture": {
      "easy": { "effort": "medium", "candidates": ["architects"] },
      "medium": { "effort": "high", "candidates": ["architects"] },
      "hard": { "effort": "high", "candidates": ["architects"] }
    },
    "admin": {
      "easy": { "effort": "low", "candidates": ["architects"] },
      "medium": { "effort": "medium", "candidates": ["architects"] },
      "hard": { "effort": "high", "candidates": ["architects"] }
    },
    "review": {
      "easy": { "effort": "low", "candidates": ["reviewers"] },
      "medium": { "effort": "medium", "candidates": ["reviewers"] },
      "hard": { "effort": "high", "candidates": ["reviewers-escalated"] }
    },
    "ship": {
      "easy": { "effort": "low", "candidates": ["workers"] },
      "medium": { "effort": "medium", "candidates": ["workers"] },
      "hard": { "effort": "high", "candidates": ["workers"] }
    },
    "scout": {
      "easy": { "effort": "low", "candidates": ["workers"] },
      "medium": { "effort": "medium", "candidates": ["workers"] },
      "hard": { "effort": "high", "candidates": ["workers"] }
    }
  }
}
